"place_id","text","rating"
"0098a8ed97daad56f4afab536d7620b8","quán máy ngon nv nhiệt tình",5
"0098a8ed97daad56f4afab536d7620b8","anh chủ quán dễ thương cực ",5
"0098a8ed97daad56f4afab536d7620b8","được chơi game free quá đã",5
"0098a8ed97daad56f4afab536d7620b8","quán này đỉnh lắm",5
"0098a8ed97daad56f4afab536d7620b8","quán net ok nhân viên nhiệt tình vui vẻ",5
"0098a8ed97daad56f4afab536d7620b8","nhân viên đẹp trai đặc biệt a cường chim siêu bự",5
"0098a8ed97daad56f4afab536d7620b8","quán không gian thoải mái phục vụ nhiệt tình",5
"0098a8ed97daad56f4afab536d7620b8","giá cả tăng nhiều quá kèm với lại bỏ nạp x2 khi nạp từ 50 đổi sang nạp 5010 giá cả không còn phù hợp hs sv",2
"0098a8ed97daad56f4afab536d7620b8","gội đầu ở đây làm mình thư giãn đầu óc nhất là sau những ngày làm việc căng thẳng",5
"0098a8ed97daad56f4afab536d7620b8","quán chương trình ngon lắm máy cũng ok",5
"0098a8ed97daad56f4afab536d7620b8","quán đỉnh nhaaa dịch vụ ổn ạ",5
"0098a8ed97daad56f4afab536d7620b8","nhân viên dễ thương cực kì trời ơi là trời lỗi phát là fix ngay xong chở qua chi nhánh khác fix tiếp dàn máy siêu mượt nói chung là đcm tuyệt vời kinh khủng người không bao giờ có khai niệm net là gì nhưng mà đm tiệm này cả nhân cả dịch vụ tuyệt vời lắm ạ  ",5
"0098a8ed97daad56f4afab536d7620b8","quán ok mát mẻ nhân viên vui vẻ",5
"0098a8ed97daad56f4afab536d7620b8","nhân viên dễ thương máy tính và internet ổn định",5
"0098a8ed97daad56f4afab536d7620b8","net sạch nhân viên nhiệt tình mới mở ok lắm mọi người ghé xem thử",5
"0098a8ed97daad56f4afab536d7620b8","quán đông khách  máy chơi tốt  nhân viên rất nhiệt tình",5
"0098a8ed97daad56f4afab536d7620b8","net cấu hình khủng nhất sg nhân viên làm việc trách nhiệm cao nhiệt tình",5
"0098a8ed97daad56f4afab536d7620b8","không gian mát mẻ thoải mái máy gear ok",5
"0098a8ed97daad56f4afab536d7620b8","hay bật phim bậy bạ cho khách",5
"0098a8ed97daad56f4afab536d7620b8","net mở cửa 247  combo ngày và đêm đồng giá 40k dàn máy cấu hình đỉnh cao  không gian chuẩn cyber",5
"0098a8ed97daad56f4afab536d7620b8","net mở 2424 máy tốt cấu hình ok mn nên trải nghiệm nhé",5
"0098a8ed97daad56f4afab536d7620b8","quán mở 247 mới tạo tài khoản được x2 luôn có phòng máy lạnh máy khoẻ",5
"0098a8ed97daad56f4afab536d7620b8","quán nét siêu thần thiện và nhiệt tình nha ",5
"0098a8ed97daad56f4afab536d7620b8","máy xịn mượt miễn phí cho hội viên 1 ngày",5
"0098a8ed97daad56f4afab536d7620b8","quán đỉnh nhaaa dịch vụ ổn lắm mấy ní",5
"0098a8ed97daad56f4afab536d7620b8","máy ngon  phòng xịn  nhân viên dễ thương",5
"0098a8ed97daad56f4afab536d7620b8","máy ngon cấu hình tốt giá hợp lí",5
"0098a8ed97daad56f4afab536d7620b8","máy ngon  anh chủ dễ thương 10 điểm nha",5
"0098a8ed97daad56f4afab536d7620b8","máy mới không gian rộng rãi nhiều máy ko bị đông",5
"0098a8ed97daad56f4afab536d7620b8","mạy lạnh phà phà cấu hình mạnh còn khuyến mãi nhiều",5
"0098a8ed97daad56f4afab536d7620b8","quán net mới thủ đức chất lượng ok mng đến trải nghiệm nha",5
"0098a8ed97daad56f4afab536d7620b8","nhân viên thân thiện máy cấu hình mạnh",5
"0098a8ed97daad56f4afab536d7620b8","nét ok có khu vực không hút thuốc 10 điểm",5
"0098a8ed97daad56f4afab536d7620b8","mát mẻ êm ái cấu hình ok mọi thứ đều ok",5
"0098a8ed97daad56f4afab536d7620b8","anh chủ 10 điểm quán xịn",5
"0098a8ed97daad56f4afab536d7620b8","net ok máy lạnh rét luôn anh em ạ",5
"0098a8ed97daad56f4afab536d7620b8","net sạch sẽ nhân viên nhiệt tình dễ thương",5
"0098a8ed97daad56f4afab536d7620b8","nhân viên nhiệt tình dễ thương cho 100 điểm ạ",5
"0098a8ed97daad56f4afab536d7620b8","trải nghiệm ở đây khá tuyệt vời đáng để thử",5
"0098a8ed97daad56f4afab536d7620b8","nhân viên nhiệt tình dịch vụ tốt cấu hình mạnh 3",5
"0098a8ed97daad56f4afab536d7620b8","quán net máy ngon xịn điều hoà mát mẻ",5
"0098a8ed97daad56f4afab536d7620b8","net xịn nha mọi người d",5
"0098a8ed97daad56f4afab536d7620b8","tiệm xịn chủ dth quá trời  ",5
"0098a8ed97daad56f4afab536d7620b8","lan quế phường nhân viên super cute máy quá ok",5
"0098a8ed97daad56f4afab536d7620b8","quán net quá tuyệt",5
"0098a8ed97daad56f4afab536d7620b8","quán bao tuyệt mình hay hút thuốc mà có phòng hút nữa",5
"0098a8ed97daad56f4afab536d7620b8","chổ này ok nha mn",5
"0098a8ed97daad56f4afab536d7620b8","net quán cấu hình máy mạnh  phục vụ tốt",5
"0098a8ed97daad56f4afab536d7620b8","nhân viên chi nhánh2 ly chưa rửa lúc nhận nc thấy ly còn đóng mảng bụi ở trong",1
"0098a8ed97daad56f4afab536d7620b8","net đẹp sạch nhân viên nhiệt tình điểm đến của gamer",5
"0098a8ed97daad56f4afab536d7620b8","net có ưu đãi cho người mới tuyệt vời",5
"0098a8ed97daad56f4afab536d7620b8","phòng cực mạnh treo 2 game  live stream 1 lúc mà vẫn vô tư nv vui vẻ không gian ok nha",5
"0098a8ed97daad56f4afab536d7620b8","net mát mẻ chơi lần đầu được test máy cả ngày nạp trên 50k được nhân 2 mọi lần",5
"0098a8ed97daad56f4afab536d7620b8","net cấu hình mạnh  nhân viên nhiệt tình  nạp đầu được x2",5
"0098a8ed97daad56f4afab536d7620b8","quán nét cấu hình ngon máy lạnh rét mỗi tội chơi đêm là quán tắt hết điện không còn bóng đèn nào rất hại mắt cho ae cày đêm",4
"0098a8ed97daad56f4afab536d7620b8","net xịn lắm ạ",5
"0098a8ed97daad56f4afab536d7620b8","cấu hình khoẻ nhân viên tận tình trải nghiệm tuyệt vời",5
"0098a8ed97daad56f4afab536d7620b8","quán cấu hình tạm ổn  nhân viên vui vẻ dễ thương",5
"0098a8ed97daad56f4afab536d7620b8","anh chủ quán đẹp zai nhân viên quá oke luôn net xịn vãi cả nho",5
"0621e39bf9eaf732b3e52d83034a3821","qua that vong dat tren app ly sz l nhung den lay chi la sz m nhan vien nói do tết nên k tang size lz  xàm làm k có tâm đung làm",1
"0621e39bf9eaf732b3e52d83034a3821","là khách quen ngày nào cx vô quán
kem làm bị bọt không đặc như mọi hôm
nước đang còn có để đồ nhân viên dẹp ly nước
để nhận khách mới vô",1
"0621e39bf9eaf732b3e52d83034a3821","khách còn để đồ ở đó mà đi toilet ra thấy dọn sạch bàn ý là đuổi khách hay gì nhân viên phục vụ thái độ kém nước thì giá cao mà dở nhạt lắm",1
"0621e39bf9eaf732b3e52d83034a3821","không đa dạng về món ăn  có đồ ăn sáng mình ăn cơm tấm ổn
đi vào các buổi còn lại thì có món mì gói bò viên
cac loại nươc ok giá từ 2955k
nơi ngồi làm việc hoặc họp mặt tốt",5
"0621e39bf9eaf732b3e52d83034a3821","ns chung là các bạn nhân viên nam đừng tụ tập chơi game vào buổi khuya nữa mình thấy khá ồn ào mà còn không lo đi dọn dẹp nước uống cho khách mong các bạn chú ý nhé",1
"0621e39bf9eaf732b3e52d83034a3821","đã thêm vào list ghé ăn trưa

không ấn tượng với món nước bằng món cơm niêu ",5
"0621e39bf9eaf732b3e52d83034a3821","quán cà phê ruột của mình ở thủ dầu một
the cup café nằm trong khu biconsi vị trí dễ tìm và không gian khá thoáng quán trang trí theo kiểu hiện đại nhẹ nhàng với tone màu trung tính nên nhìn vào ",5
"0621e39bf9eaf732b3e52d83034a3821","mua 2 phần cơm cũng 55k 1 phần mà nhận lại cách đóng gói như vậy hộp cơm k có nổi 1 cái nắp nhân viên cũng không nói gì",2
"0621e39bf9eaf732b3e52d83034a3821","nước thì cái ngọt cái lạc như nước lã ghé thấy ghế dài nghỉ trưa xíu thấy nhân viên đi qua đi lại không nhắc mà lúc mình đang say giấc lại kiu ko dc nằm nhân viên thì tụ tập chỉ chỉ trỏ trỏ khách đi rất nhìu lần mà h ms thấy bất xúc  ",1
"0621e39bf9eaf732b3e52d83034a3821","không gian quán rất rộng và mát mẻ phong cách hiện đại đồ uống ngon giá hợp lý nhân viên chuyên nghiệp có chỗ đậu xe miễn phí trên đường nằm trong khu vực sầm uất và giao thông thuận lợi",5
"0621e39bf9eaf732b3e52d83034a3821","không gian thưởng thức trà và cà phê tuyệt vời
sang trọng thoáng mát sạch sẽ lịch thiệp và chuyên nghiệp là điểm cộng  cho cửa hàng up  the cup cafe ",4
"0621e39bf9eaf732b3e52d83034a3821","không gian rộng sang trọng có nhiều ổ cắm phù hợp để làm việc học tập

nhân viêc phục vụ thái độ chuyên nghiệp nhà vệ sinh sạch sẽ thơm tho nước uống ổn",4
"0621e39bf9eaf732b3e52d83034a3821","nằm trong kdc phú hoà buổi tối đông khách quán mở muộn có bóng đá là tới 23h sáng mới đóng cửa nước trung bình vừa phải  chỗ ngồi ngoài trời để bán sát nhau quá mất tự nhiên hic chỗ ngồi bên trong oke yên tĩnh",5
"0621e39bf9eaf732b3e52d83034a3821","không gian thoải mái  nước ngonn  đồ ăn cũng ngon  nhân viên dễ huông nửa ",4
"0621e39bf9eaf732b3e52d83034a3821","không gian thoáng đãng rộng rãi thoải mái hợp lý ngồi làm việc và chạy deadline",5
"0621e39bf9eaf732b3e52d83034a3821","quán này có mở đêm quán rất đông khách",5
"0621e39bf9eaf732b3e52d83034a3821","quán nằm vị trí đắt địa ngay trung tâm thương mại phú hoà nên khoá đông đúc thức ăn tạm ổn thức uống phong phú tuy nhiên phục vụ còn hơi chậm khá ồn ào do máy lạnh kêu to hoà với tiếng ồn do kê bàn quá dày không thích hợp cho người lớn tuổi",4
"0621e39bf9eaf732b3e52d83034a3821","quán nằm ngay vòng xoay kdc phú hoà  tỉnh bình dương

có chỗ đậu xe máy và ô tô  có bv giữ xe an toàn ",5
"0621e39bf9eaf732b3e52d83034a3821","đồ ăn ngon  vì khác vùng miền nên nước mắm hơi ngọt so với mình ",4
"0621e39bf9eaf732b3e52d83034a3821","quán nằm ngay vòng xoay kdc phú hoà

có chỗ đậu xe máy và ô tô ",5
"0621e39bf9eaf732b3e52d83034a3821","08082025 nhân viên chú ý lại nhé ly nước  cũng may là không phải con ruồi thường xuyên uống ở đây đây là lần đầu tiên bị như thế này",4
"0621e39bf9eaf732b3e52d83034a3821","the cup cafe là 1 thương hiệu nổi tiếng thì về chất lượng không gian cùng với đồ ăn thức uống thì khổi phải bàn còn về việc phục vụ thì mỗi chổ mỗi kiểu ae cảm nhận mỗi người mỗi khác nên ko nào đánh đồng đc  làm đồ mang đi hơi lâu ",4
"0621e39bf9eaf732b3e52d83034a3821","view rộng nhân viên nhiệt tình
từ t2 đến t6 có cơm niêu mình ghé t7 ăn tạm phở không ngon lắm
cappuccino không ngon",3
"0621e39bf9eaf732b3e52d83034a3821","mình khách ruột ở đây từ cà phê đen đá không đường kombucha rồi đồ ăn trưa ở đây
ngồi cf làm việc ở đây khá là okla nhé",5
"0621e39bf9eaf732b3e52d83034a3821","dạ matcha đá xay hôm nay không như những đợt trước em hay uống kem thì không như thường ngày nó cứ bọt không đặc matcha nhạt và kể cả hình thức khác thường quán cần xem xét lại rất không hài lòngtrân trọng",1
"0621e39bf9eaf732b3e52d83034a3821","đợi đồ ăn quá lâu bảo 15 phút nhưng 30 phút sau nhắc nhở mới có
nhân viên thái độ
tệ",1
"0621e39bf9eaf732b3e52d83034a3821","the cup cafe nằm trên đường d1 chung cư biconsi phường phú hòa thủ dầu một bình dương gần vòng xoay xe ra vào khá dễ kể cả xe hơi quán cafe mở 2424 nên rất phù hợp cho các bạn trẻ cày đêm với chi phí thấp quán được thiết kế mặt ngoài ",5
"0621e39bf9eaf732b3e52d83034a3821","đợi nước hơn 25 phút làm cho tất cả mọi người xong chờ hoài cũng k thấy tới lượt nhân viên không một câu nói mình xong mới pha rồi thôi tính ra làm dịch vụ mà mấy cái cơ bản cũng k biết ",1
"0621e39bf9eaf732b3e52d83034a3821","the cup cafe ở biconsi phú hòa thực sự làm mình ấn tượng với không gian ấm cúng và bài trí rất chill đồ uống ở đây ngon và phục vụ cực kỳ nhiệt tình có điều âm nhạc hơi to làm mất chút thư giãn nhưng tổng thể thấy ổn sẽ quay lại",5
"0621e39bf9eaf732b3e52d83034a3821","the cup cafe vietnam có không gian được thiết kế đẹp mắt rất thích hợp để chụp ảnh và thư giãn đồ uống ở đây đa dạng hương vị thơm ngon đặc biệt là các loại cà phê nhân viên phục vụ thân thiện và chu đáo để tăng cường sự gắn kết quán ",5
"0621e39bf9eaf732b3e52d83034a3821","the cup cafe vietnam thực sự là một điểm đến lý tưởng cho những ai cần không gian làm việc hay thư giãn suốt cả ngày với ưu điểm mở cửa 2424 quán có thiết kế theo phong cách châu âu hiện đại rộng rãi và tràn ngập ánh sáng tự nhiên nhờ ",5
"0621e39bf9eaf732b3e52d83034a3821","the cup phú hòa nằm ngay vòng xoay phú hòa vị trí cực kỳ dễ tìm và thuận tiện cho cả học sinh  sinh viên dân văn phòng hay anh em ghé nhanh một ly cà phê mang đi ",5
"0621e39bf9eaf732b3e52d83034a3821","dự là đến ăn combo nhưng đến 1230 mà đã hết
phải gọi lẻ nên mất nhiều tiền hơn nên có nhiều hơn để đủ phục vụ tốt hơn
lần trước báo hết trái cây không mang ra thêm được nhưng khi mình ăn xong lại ",4
"0621e39bf9eaf732b3e52d83034a3821","mình đi hôm 1512 thấy có bảng này và mua thử nước trong danh sách xanh tinh tú nước mình có dặn nhân viên ít đá ít ngọt nhưng không thấy note vào bill lúc nhận thì xin cốc để vớt đá ra được chừng này do quán đông nên chắc cũng không ",3
"0621e39bf9eaf732b3e52d83034a3821","ê cái món này dở nhỏ xíu mà tận 55 kh đáng thực sự youkur xoài nha",1
"0621e39bf9eaf732b3e52d83034a3821","quán rất rộng không gian thoáng mát nhà vệ sinh sạch sẽ có chổ để ô tô và xe gắn máy thức ăn ngon buổi trưa có bán thêm đồ ăn trưa",4
"0621e39bf9eaf732b3e52d83034a3821","cơm gà mắm tỏi lúc trước sài cơm chiên đến khi ghé mua lại thì dùng cơm trắng nv od cũng kh báo trước cho khách cơm thì khô đóng cục lại kh đáng tiền",1
"0621e39bf9eaf732b3e52d83034a3821","mình đến cup từ lúc mới mở cửa và từ hôm nay mình sẽ không ghé lại nữa
tạm biệt nơi mình gắn bó để hoàn thành nhiều dự án ở cup thì thức uống không có gì đặc biệt nhưng cái giữ chân mình lại chính là không gian và thái độ của nhân viên nhưng hôm nay tất cả điểm cộng ấy đã không còn",1
"0621e39bf9eaf732b3e52d83034a3821","có lần đi ngang qua quán vào buổi tối thấy quán rất đẹp và sang nên lần sau vào định chụp choẹt vài tấm hình nhưng mà mình đi vào buổi chiều thấy trong quán toàn khách vào học với làm việc cả thôi nên khá ngại ",4
"0621e39bf9eaf732b3e52d83034a3821","quán rộng rãi thoáng mát nhưng điểm trừ là nước uống ly đó có hạt sen mà hạt sen nó đắng mong quán cải thiện lại giúp chứ bỏ tiền ra 1 ly nước kh phải rẻ mà trải nghiệm tệ quá",2
"0621e39bf9eaf732b3e52d83034a3821","hảo menu cơm niêu ngon ăn kèm salad trộn mayonnaise trái cây tráng miệng trà đá tự phục vụ thật ổn giá chỉ 55k ",5
"0621e39bf9eaf732b3e52d83034a3821","mình biết đến the cup cafe đã lâu nhưng hôm nay mới có dịp ghé qua ngồi lại lâu để chạy deadline và trải nghiệm thực sự vượt ngoài mong đợi ",5
"0621e39bf9eaf732b3e52d83034a3821","nhân viên thái độ với khách nếu cảm thấy đi làm không vui vẻ được thì đừng làm ",1
"0621e39bf9eaf732b3e52d83034a3821","menu đầy đủ từ thức uống bánh snack đến đồ ăn đặc biệt là cơm niêu
dịch vụ tốt
không gian rộng rãi sạch ",5
"0621e39bf9eaf732b3e52d83034a3821","có các món ăn giá từ 55kphần
không gian rộng
khu vực vệ sinh sạch sẽ và thơm mát ",5
"0621e39bf9eaf732b3e52d83034a3821","matcha latte không ngon toàn có vị sữa đặc không có chút nào vị matcha cả những món khác của the cup ngon nhưng riêng món này chê nha",3
"0621e39bf9eaf732b3e52d83034a3821","matcha đá xay dở không có vị ngọt toàn bột matcha uống rất đắng có hỗ trợ đổi ly nhưng nhân viên đem lại thì thái độ nói là do bột matcha có vị hậu đắng không có chỗ ngồi nhân viên sắp xếp bàn lâu ở khu vực bên ngoài trời mưa ướt bàn ghế nhân viên không lau đợi 30p mới có chỗ ngồi",1
"0621e39bf9eaf732b3e52d83034a3821","bầu không khí thoáng mát với nhiều cây xanh bãi đậu xe rộng rãi và nhân viên nhiệt tình chan hỏi",3
"0621e39bf9eaf732b3e52d83034a3821","hỏi nhân viên món best seller thì được gợi ý món tứ quý long nhãn hạt sen nhưng mà hạt sen cảm giác sượng sượng cứng cứng như chưa chín chứ không như những quán khác mình từng thử nó mềm và bùi",1
"0621e39bf9eaf732b3e52d83034a3821","tr oiii bạn nvien này dth ghê lun á pvu siu nhiệt tình lun  ",5
"0621e39bf9eaf732b3e52d83034a3821","trà xanh latte lẫn trà xanh đá xay đều khá dở vị nhạt nhẽo không vị trà xanh mà vị sữa cx lờ lợ nhân viên thái độ tệ không ghé lần sau  ",1
"0621e39bf9eaf732b3e52d83034a3821","quán đẹp  không khí mát mẻ thái độ phục vụ ok nhưng ra món đợi hơi lâu tí",5
"0621e39bf9eaf732b3e52d83034a3821","quán quá là ok mở 247 có không gian rộng cả trong và ngoài ghế bàn ok mềm tốt thư giản nói chung khá là tốt ko có điểm trừ j",4
"0621e39bf9eaf732b3e52d83034a3821","hôm nay mình đi với gia đinh vào lúc 0020 bạn nam đứng quầy oder rất thái độ với kháchkhách oder hỏi món thì k thèm nhìn thái độ rất tệ
đi làm là tự nguyện hay ai ép đi làm mà sao k đc vui í the cup xem lại thái độ nhân viên nha",1
"0621e39bf9eaf732b3e52d83034a3821","quán có vị trí rất đẹp ở chân căn hộ chung cư phú hòa mặt bằng rộng rãi đậu xe thoải mái quán trang trí đẹp thanh lịch đơn giản thức uống ngon đồ ăn tương đối ổn bánh mì ngon nhưng hơi cay nên phải dặn ớt ít thực đơn giá phù hợp với khu cao cấp từ 3080ng nhà vệ sinh hơi xa và chưa sạch lắm đánh giá tổng thể 4",4
"0621e39bf9eaf732b3e52d83034a3821","quán có trí đẹp không gian rộng rãi thoáng mát
menu nước đa dạng các loại trà sữa hạnh nhân ít ngọt khá hợp khẩu vị của mình đồ ăn cũng đa dạng có cơm phở hủ tiếu mình gọi mì ý theo mình thì ở mức ổn ",4
"0621e39bf9eaf732b3e52d83034a3821","trà xanh đá xay vị ngọt ngay ko có tý vị trà trà cam quế thì nhạt nhẽo quá tệ ",5
"0621e39bf9eaf732b3e52d83034a3821","quán có không khí yên tĩnh nhiều ổ điện thích hợp làm việc cafe và trà sữa theo phong cách nhẹ nhàng vị hơi chua không quá đắng",4
"0621e39bf9eaf732b3e52d83034a3821","quán có không gian thoáng ngay vòng xoay
có cả phòng máy lạnh và ngoài trời
món nước phong phú pha tương đối ngon nhiều loại bánh ",5
"0621e39bf9eaf732b3e52d83034a3821","trải nghiệm tệ nhất trong các chi nhánh up từng ghé thu ngân bắt khách phải trả tiền lẻ mặc dù khách không muốn tiếp đó tôi có dựng 1 đế standee nhỏ để làm 1 buổi trò chuyện nhỏ bằng tiếng anh để rất sát bàn không ảnh hướng đến lối đi  ",1
"0b10568015d253d7a446eea81905834b","ưu rất rẻ phục vụ hiền dễ thương quên lên món 45 bàn vô sau có món mà mình chưa nên mình nhắc nhưng xin lỗi suốt thoáng mát
nhược cơm chiên ko ngon thịt hơi nhiều mỡ nước chấm nhiều loại nhưng ko ngon",4
"0b10568015d253d7a446eea81905834b","đồ ăn ngon không gian thoải mái hơn chi nhánh 1 phần đồ nứong được có 1 trái đậu bắp mà còn chẻ đôi ra nhìn ngứa mắt nhân viên nên để ý dọn bàn cho khách xíu để trãi nghiệm của khách tốt hơn như bàn mình đi đông ăn nhìu mà dĩa nồi chồng trên bàn để dưới đất tùm lum mà không ai dọn nhìn không thoải mái",4
"0b10568015d253d7a446eea81905834b","đi ăn rất nhiều lần cả 2 chi nhánh mà nv bên đây rất md md nhất là th ql khách nch đ thèm trl một tiếng thái độ các kiểu ko biết ql hay là con chủ nữa nên train lại nv học hỏi theo chi nhánh 1 ko thì mất khách như chơi",1
"0b10568015d253d7a446eea81905834b","đồ ăn ngon giá mềm  ",5
"0b10568015d253d7a446eea81905834b","đồ ăn ngon có bạn nhân viên tên kha phục vụ rất dễ thương và nhiệt tình lắm",5
"0b10568015d253d7a446eea81905834b","đồ ăn cũng được giá rẻ mưa nhưng vẫn rất đông khách menu thì hơi ít món đi ăn 1 lần gọi hết menu rồi phục vụ có như không phải gọi nhắc 30p mới bưng than lên hoặc dọn dẹp chén đĩa dơ dùng rồi còn lại thì chỉ bấm đt hoặc tụm lại nói chuyện lúc mình đến bàn nhớt dầu như chưa lau dọn",3
"0b10568015d253d7a446eea81905834b","đồ ăn chất lượng giá cả hợp lí nhân viên nhiệt tình nhanh nhẹn",5
"0b10568015d253d7a446eea81905834b","đồ ăn chấp nhận được nói chung bình dân nhược điểm ngày t7 hoặc lễ k đặt k có trước ngày bình thường cũng có thể vậy nhậu lai rai cũng rất ok",5
"0b10568015d253d7a446eea81905834b","thuận tiện đi lại có chỗ gửi xe an toàn",3
"0b10568015d253d7a446eea81905834b","món nướng mình ăn ở đây rất okenma hnay mua nghêu hấp thái ở đây thì rất tệnước dùng thì mặn còn nghêu thì kh vệ sinh sạch sẽ ăn 1 con vô mà toàn là cát nên bỏ hết cả phần ăn luôn ",2
"0b10568015d253d7a446eea81905834b","nhân viên đây cực tệ mình đi ăn gọi món đợi 30 mới ra món trong khi đó nhờ nv thay vỉ tận 34ng mà k ai thay mà cứ đứng bấm đt riết rau là dc cho free mà phải xin tới khi ăn xong r mới đưa ra đồ ăn thì dạo này k còn tươi như trc nữa nv cx tệ hơn trc",1
"0b10568015d253d7a446eea81905834b","đồ ăn ngon lên món nhanh nhân viên tốt",5
"0b10568015d253d7a446eea81905834b","mình vô tình đi ngang và thấy quán khá đông xe nên cũng tấp vào thử không gián quán không quá rộng nhưng sắp xếp bàn ghế bố cục rất hài hoà
đồ ăn tươi ngon và giá mình thấy khá bình dân nhân viên phục vụ ok ",5
"0b10568015d253d7a446eea81905834b","nhân viên ngọc thanh có thái độ khó chịu với khách hàng từ khi mới vào bạn ngoài ra bạn order thiếu món để cho tụi mình đợi khá lâu vậy mà khi được phản ánh thì chỉ tìm lý do biện hộ đổ lỗi do hệ thống thậm chí tụi mình chưa nói xong ",1
"0b10568015d253d7a446eea81905834b","mình mới biết quán này trung thu 61025",5
"0b10568015d253d7a446eea81905834b","nhân viên phục vụ rất tệ và vệ sinh chén đũa rất dơ",1
"0b10568015d253d7a446eea81905834b","bạn khang phục vụ nhiệt tình chu đáo món ăn ngon ốc nhồi hơi nguội nhân viên vẫn hỗ trợ hâm nóng lại",5
"0b10568015d253d7a446eea81905834b","mình đã ghé quán khá nhiều lần mấy bạn nhân viên phục vụ tốt dù quán đông nhiệt tình không đợi quá lâu 10đ nha quán cũng tinh tế nữaaaa",5
"0b10568015d253d7a446eea81905834b","mình ăn ở ngạn rất nhiều lần rồi lần này quay lại thất vọng vô cùng nhân viên tính từ lúc bước vô bàn ngồi lơ khách ra mặt lun mk kêu order món hơn 10 lần nhân viên nhìn rồi quay đi làm vc khác không order trong khi bạn mk nhìn vô trong thấy nv vẫn đứng nch và giỡn vs nhau một trải nghiệm đáng buồn và mất thời gian ",1
"0b10568015d253d7a446eea81905834b","miếng đậu bắp nằm như thế ngay trên thịt mà từ bếp đến nhân viên đều không thấy thậm chí lúc mình chụp là con sâu còn sống đã bò ra ngoài rồi nhân viên thì phải đợi hỏi món sao lâu vậy mới báo đang nhập về",2
"0b10568015d253d7a446eea81905834b","mấy bạn nhân viên rất nhiệt tình và chiều khách hôm nay mình mua mang về được mấy bạn nướng cho rất nhiệt tình dù quán đang rất đông đồ ăn rất ngon phục vụ 10 điểm",5
"0b10568015d253d7a446eea81905834b","nhân viên thân thiện nhiệt tình mới nhìn thôi là biết mình cần gì luôn một trải nghiệm tại quán vui vẻ",5
