"place_id","text","rating"
"645eb0bbad4d97068d6c430a4d48be2b","món ăn ở dookki coop xtra linh trung rất ngon nước sốt đa dạng mới có thêm sốt muối ớt xanh chấm hải sản ngon lắm nha nhân viên phục vụ thân thiện nhiệt tình và luôn hỗ trợ khách hàng chu đáo không gian sạch sẽ thoáng mát rất thích hợp để đi cùng bạn bè",5
"645eb0bbad4d97068d6c430a4d48be2b","một lần trải nghiệm tuyệt vời khi đi ăn ở dooki đồ ăn hợp khẩu vị nhân viên thì tận tâm nói chung là đỉnh khỏi bàn",5
"645eb0bbad4d97068d6c430a4d48be2b","đầu tiên về đồ ăn  rau úng héo dập vẫn được bày trên quầy line  đối với xúc xích trên quầy đông lạnh bị rùi bu 2 3 con trong hộc  mình không kịp chụp lại và đuổi rùi đi vạch ra vẫn còn rùi bị chết trong đó  tại sao có thể để khách ",2
"645eb0bbad4d97068d6c430a4d48be2b","đồ ăn thì thưa thớt các sản phẩm không có hàng không nói trước với khách line đồ ăn ko gọn gàng các đồ ăn trên line rõ ràng đã để lâu nên bị gió ỉu cả dưa hấu và gà",1
"645eb0bbad4d97068d6c430a4d48be2b","chất lượng dịch vụ tuyệt vời nhân viên hỗ trợ dịch vụ thân thiện",5
"645eb0bbad4d97068d6c430a4d48be2b","món ăn ở dookki coop xtra linh trung rất ngon nước sốt đa dạng và topping luôn tươi mới nhân viên phục vụ thân thiện nhiệt tình và luôn hỗ trợ khách hàng chu đáo không gian sạch sẽ thoáng mát rất thích hợp để đi cùng bạn bè",5
"645eb0bbad4d97068d6c430a4d48be2b","đi thứ 3 vì món đậu hũ phô mai tới hỏi thì kêu hết 2 món mới rồi  t6 mới có hàng là sao đồ ăn lên chậm rau salad héo queo không gian quán thì nóng",1
"645eb0bbad4d97068d6c430a4d48be2b","đồ ăn ngon nv phục vụ tốt  ",5
"645eb0bbad4d97068d6c430a4d48be2b","đồ ăn ngon tuyệt nvien dễ thương",5
"645eb0bbad4d97068d6c430a4d48be2b","theo mình cảm nhận thì nước sốt pha phải nhiều hơn mấy chi nhánh khác mới ra vị hay ăn về phần nước thì đủ nước ngọt nhưng phần trà sữa lại k fill nên không có uống đồ ăn thì vẫn như chi nhánh khác không có gì để nói",5
"645eb0bbad4d97068d6c430a4d48be2b","chi nhánh này fill thịt rất nhanhgà hơi khô nhưng tạm chấp nhận đượcnhân viên nhanh nhẹn dễ thương",5
"645eb0bbad4d97068d6c430a4d48be2b","nhân viên nhiệt tình đồ ăn ngon mình sẽ quay trở lại",5
"645eb0bbad4d97068d6c430a4d48be2b","quán okieee lắm ạ refill đồ ăn liên tục lun có kem nữa hehe",5
"645eb0bbad4d97068d6c430a4d48be2b","ngon lắm ạ mình ăn sạch sành sanh luôn ạ",5
"645eb0bbad4d97068d6c430a4d48be2b","nhân viên dễ thương và nhiệt tình không gian quá khá ấm cúng đồ ăn refill rất nhanh",5
"645eb0bbad4d97068d6c430a4d48be2b","nhân viên dễ thương nhiệt tình đồ ăn ngon chất lượng",5
"645eb0bbad4d97068d6c430a4d48be2b","nhìn bàn ăn sạch sẽ là mn hiểu rồi đó 
gà rán ở chi nhánh này ngon nhen nhân viên nhiệt tình lắm",5
"645eb0bbad4d97068d6c430a4d48be2b","đồ ăn ngon nhân viên dễ thương",5
"645eb0bbad4d97068d6c430a4d48be2b","đồ ăn ngonfill đồ rất nhanhquán sạch sẽgà ăn ngonnóng giònđồ ăn hơi ít nhưng quán fill liên tục nên ko thiếu đồpepsi hơi ngọt nhưng các nước khác bình thường nha báo nhân viên là sẽ được thay ly nướctrà sữa ngonsẽ quay lại",5
"645eb0bbad4d97068d6c430a4d48be2b","nhân viên dễ thương nhiệt tình cute đồ ăn ngon ",5
"645eb0bbad4d97068d6c430a4d48be2b","đồ ăn tạm ổn nhân viên phục vụ thân thiện nhất là bn nhân viên nữ đeo mắt kính khá là nhiệt tình",5
"645eb0bbad4d97068d6c430a4d48be2b","mấy bạn nhân viên dễ thương xĩuuuu phục vụ tận tâm nhiệt tình cho khách lần đầu tiên tới quán như tui luôn",5
"645eb0bbad4d97068d6c430a4d48be2b","đồ ăn ngon nhân viên nhiệt tình ạ",5
"645eb0bbad4d97068d6c430a4d48be2b","hôm nay đi ăn hôm nay thấy nước sốt lẩu quá là nhạt luôn mình đã bỏ rất nhiều sốt rồi mà vẫn thấy nhạt toẹt
bù lại thì đồ ăn fill cũng đầy đủ mấy bạn nhân viên rất nhiệt tình dễ thương nhanh nhẹn",4
"645eb0bbad4d97068d6c430a4d48be2b","vừa ăn xong đây ạ còn tổ chức sinh nhật nữa mấy chị nhân viên dễ thương lắm ạ siêu nhiệt tình luôn quay lại quài luônnniu chi nhánh này lớmm",5
"645eb0bbad4d97068d6c430a4d48be2b","mấy bạn pv dễ thương nha đồ ăn fill liên tục ko sợ hết đồ ăn nè gà dookki thì ngon khỏi bàn luôn",5
"645eb0bbad4d97068d6c430a4d48be2b","bữa tui ăn là 26 tết và tui đi một mình vào đó thì được mấy bạn nhân viên take care rất tốt có quạt siêu mát đồ ăn fill rất đầy đủ có 1 điểm nhỏ là gà nguội và hơi khô do để lâu nhưng mà đó không ảnh hưởng đến trải nghiệm của tui ở cơ sở này vẫn sẽ tiếp tục ủng hộ vì gần ktx khu b và đi lại rất tiện",5
"645eb0bbad4d97068d6c430a4d48be2b","đồ ăn ngon nhân viên nhiệt tình dth rất thích",5
"645eb0bbad4d97068d6c430a4d48be2b","đồ ăn ngon nhân viên nhiệt tình không gian thoải mái có kem",5
"645eb0bbad4d97068d6c430a4d48be2b","mình cho rằng dooki là một lựa chọn khá tốt nếu bạn muốn thử buffet tokbokki  lẩu hàn quốc theo phong cách tương tác  tự pha sốt mix topping theo sở thích nó phù hợp cho nhóm bạn muốn ăn chung thử nhiều vị khác nhau đổi gió nhân viên nhiệt tình dễ thương đồ ăn fill nhanh",5
"645eb0bbad4d97068d6c430a4d48be2b","đồ ăn ngon nhân viên nhiệt tình thái độ tốt phục vụ chu đáo",5
"645eb0bbad4d97068d6c430a4d48be2b","trải nghiệm oke nhân viên tuyệt vời phục vụ oke đồ ăn fill liên tục",5
"645eb0bbad4d97068d6c430a4d48be2b","mình đi vào buổi trưa hơi vắng nhân viên phục vụ nhiệt tình",5
"645eb0bbad4d97068d6c430a4d48be2b","đồ ăn ngon nhân viên phục vụ mấy bạn dễ thương nhiệt tình",5
"645eb0bbad4d97068d6c430a4d48be2b","cái quầy đồ ăn phụ ngon refill liên tục không gian thoáng đãng phù hợp cho gia đình nhóm bạn cặp đôi",5
"645eb0bbad4d97068d6c430a4d48be2b","đồ ăn được refill đầy đủ nhân viên hỗ trợ nhiệt tình khi có vấn đề không gian thoải mái mát mẻ chưa gặp nhân viên quán nào dễ thương như quán này",5
"645eb0bbad4d97068d6c430a4d48be2b","đồ ăn ngon nhân viên phục vụ nhiệt tình ",5
"645eb0bbad4d97068d6c430a4d48be2b","hôm nay 432026 ca tối tầm 18h có 3 bạn nhân viên siêu dễ thương và siêu nhiệt tình luôn  tụi mình đi ăn chi nhánh này cũn nhiều ròi lúc nào cũn gặp 3 bạn này lúc nào cũn dth và nhiệt tình hết fill đồ cũn ổn áp ",5
"645eb0bbad4d97068d6c430a4d48be2b","nước pha lẩu hơi nhạt so với các chi nhánh mình từng ăn đồ ăn được refill đầy đủ nhân viên hỗ trợ nhiệt tình khi có vấn đề không gian thoải mái mát mẻ",5
"645eb0bbad4d97068d6c430a4d48be2b","ngon nv phục vụ nhiệt tình",5
"645eb0bbad4d97068d6c430a4d48be2b","nhân viên rất dễ thương luôn aaaa nhất là anh nhân viên đồ ăn fill nhanh thịt fill cho siêu nhiều ăn rất thoải mâiiiiiii 1000000đ ko hề seeding",5
"645eb0bbad4d97068d6c430a4d48be2b","quán rất nóng thịt heo không có vào lúc 18h49 và đợi cả tiếng cũng không có đồ ăn thả lẩu quầy line cũng ít đồ hơn các chi nhánh khác nghêu thì cát và chết khá nhiều không có chân gà chả cá trên quầy thì rất mặn hy vọng quán sẽ cải thiện chứ thế này thì quá thất vọng",1
"645eb0bbad4d97068d6c430a4d48be2b","hôm mình đi là 19 thiếu trà sữa còn lại thì đầy đủ hết
mấy nv nữ dễ thương nhanh nhẹn còn bạn nv nam mình hỏi vs nói 2 lần ko thấy phản ứng lại  ",5
"645eb0bbad4d97068d6c430a4d48be2b","đồ ăn ngon dịch vụ tốt",5
"645eb0bbad4d97068d6c430a4d48be2b","trải nghiệm mới lẫu tự chọn ngon lạ nha",5
"645eb0bbad4d97068d6c430a4d48be2b","gia đình mình cũng hay ăn ở đây buffet giá ổn đồ ăn ok",5
"645eb0bbad4d97068d6c430a4d48be2b","đồ ăn ngon lắm nhân viên refill rất là nhanh",5
"645eb0bbad4d97068d6c430a4d48be2b","mình đã ghé ở đây rất nhiều lần đồ ăn ngon các bạn nhân viên rất dễ thương nhanh nhẹn hỗ trợ nhiệt tình",5
"645eb0bbad4d97068d6c430a4d48be2b","nhân viên phục vụ rất dễ thương
dookki ở đây hơi vắng quầy line luôn đầy đủ lượng đồ ăn phù hợp với khách hàng ",5
"6c57ff9df2a76264b13137a921d87f8b","nước hợp khẩu vị không gian thoải mái mát mẻ box sạch sẽ nhân viên nhiệt tình mình đã đi nhiều lần thấy các bạn nv đều hỗ trợ rất dth chứ k đến mức thái độ như các đánh giá trước đó nói chung là nơi hợp lí để nghỉ ngơi và chạy deadline nè  ",5
"6c57ff9df2a76264b13137a921d87f8b","sạch sẽ box thơm nhạc jazz chill lắm đồ ún ngon nha đồ ăn chx thử chx bt",5
"6c57ff9df2a76264b13137a921d87f8b","rộng rãi thoáng mát và yên tĩnh phù hợp học bài",5
"6c57ff9df2a76264b13137a921d87f8b","dịch vụ ở đây rất tốt thoải mái và tiện nghi đầy đủ ạ recommend mọi người đến trải nghiệm nha",5
"6c57ff9df2a76264b13137a921d87f8b","không gian đẹp quán chill box sử dụng ổn sạch sẽ nước ngon và chất lượng tốt",5
"6c57ff9df2a76264b13137a921d87f8b","thái độ nhân viên quá kém nước uống tạm ổn bánh ngon không gian decor xinh tất cả đều okie chỉ có nhân viên là không ổn rất thái độ này nọ",2
"6c57ff9df2a76264b13137a921d87f8b","quán yên tĩnh nhân viên thân thiện lịch sự sẽ quay lại lần sau",5
"6c57ff9df2a76264b13137a921d87f8b","địa điểm tuyệt vời để thư giãn cùng bạn bè và người yêu giá cả hợp lí đồ ăn thức uống ngon miệng",5
"6c57ff9df2a76264b13137a921d87f8b","quán thơm nhân viên nhiệt tình dễ thương đồ uống ngon rcm cho mng nếu muốn một nơi yên tĩnh nha ",5
"6c57ff9df2a76264b13137a921d87f8b","quán thì phục vụ oke mình không thấy vấn đề gì hết ngoại trừ bác bảo vệ tỏ thái độ khó chịu và to tiếng khi mình dắt xe ra lý do xe kẹt trong hóc nên lấy xe ra khó bác bảo vệ không giúp còn to tiếng",4
"6c57ff9df2a76264b13137a921d87f8b","quán thích hợp cho cafe thư giản hoặc đơn giản cho ai tìm chổ nghỉ ngơi hay học bài nhân viên rất lịch sự",5
"6c57ff9df2a76264b13137a921d87f8b","quán sở hữu không gian khá độc đáo và hiện đại với thiết kế sleep box tạo ra sự riêng tư tuyệt đối cho khách hàng các sleep box được trang bị đầy đủ với giường đèn đọc ổ cắm điện và cả wifi miễn phí nếu bạn cần một không gian yên ",5
"6c57ff9df2a76264b13137a921d87f8b","quán sạch sẽ yên tĩnh nhân viên nhiệt tình dễ thương  ",5
"6c57ff9df2a76264b13137a921d87f8b","quán sạch sẽ đồ uống ngon hơn mong đợi đặc biệt các bạn nhân viên rất nhiệt tình và lễ phép mức giá khá ổn",5
"6c57ff9df2a76264b13137a921d87f8b","quán rộng rãi sạch sẽ và mấy bạn nhân viên siêu dễ thương",5
"6c57ff9df2a76264b13137a921d87f8b","decor xinh lắm nhân viên thân thiện nói chuyện nhẹ nhàng
nước uống thì đúng ý mình
cacao nóng thơm béo đăng đắng nhẹ hợp vị ",5
"6c57ff9df2a76264b13137a921d87f8b","quán này thích hợp gặp bạn bè lâu năm tại vì không khí ngại ngùng của quán lạ lắm giống như bạn 10 năm rồi mới gặp không biết nói chuyện gì ngoài ôn kỉ niệm",4
"6c57ff9df2a76264b13137a921d87f8b","quán nằm gần gà rán lotteria đối diện nhà văn hoá thiếu nhi có tầng hầm giữ xe quán phòng máy lạnh tầng 1 các tầng trên là giường tầng theo tiếng có rất nhiều cặp đôi thuê giường mình đi 1 mình nên ngồi tầng trệt món bánh mì bơ tỏi rất giòn thơm ngon matcha latte cũng ổn 910",5
"6c57ff9df2a76264b13137a921d87f8b","đã đi rất nhiều lần nhưng hôm nay mới có thời gian để đánh giá gg map điều cảm nhận đầu tiên đó là nhân viên hỗ trợ và tận tâm với mình lắm mình muốn đổi box vì lí do đau chân ko leo cầu thang đc nhân viên sẵn sàng hỗ trợ rất dễ chịu dễ ",5
"6c57ff9df2a76264b13137a921d87f8b","đồ uống ngon thoải mái nhân viên nhiệt tình",5
"6c57ff9df2a76264b13137a921d87f8b","ép táo ngon thanh mát box rộng rãi
các bạn phục vụ nhiệt tình",5
"6c57ff9df2a76264b13137a921d87f8b","hơi nóng nhưng có quạt riêng từng box nha nc bth nhưng mình thik croissant ở đây giòn và cảm nhận được cái texture nhìu lớp",5
"6c57ff9df2a76264b13137a921d87f8b","quán đẹp nvien dễ thương nhiệt tình nước cũng ngon nữa mình với bạn mình quay lại cucng nhiều lần r á nói chung là ưng ",5
"6c57ff9df2a76264b13137a921d87f8b","quán đẹp nhân viên thân thiện nước ngon và yên tĩnh thích hợp để học tập cũng như làm việc",5
"6c57ff9df2a76264b13137a921d87f8b","không gian đẹp yên tĩnh để ngồi lâu uống cà phê và trà sữa ngon",5
"6c57ff9df2a76264b13137a921d87f8b","quán còn mới sạch sẽ và ngăn nắp nước vừa vị giá chỉ 130k cho 2 ly nước  4 tiếng điều mình ko thích lắm khi mới bước vào box có mùi hơi nồng",5
"6c57ff9df2a76264b13137a921d87f8b","quán có ngoại thất xinh còn nội thất bên trong nhìn rất là chill xinh ấm áp nước bên này cũng ngon nữa rcm món trà cam đào dâu nhoaaa mình dùng combo 1 in bed ấn tượng đầu tiên là lối đi lên rất sạch sẽ phòng ốc cũng sạch và xinh ",5
"6c57ff9df2a76264b13137a921d87f8b","quán có không gian ấm cúng thiết kế tối giản nhưng tinh tế đồ uống chất lượng cà phê thơm và cân bằng vị nhân viên phục vụ nhanh nhẹn thân thiện rất thích hợp để làm việc hoặc đọc sách",5
"6c57ff9df2a76264b13137a921d87f8b","quán có 2 khu phần lớn là dùng gỗ kết hợp với tường trắng vàng tạo cảm giác ấm cúng vào là thấy thư giãn liền
tầng trệt là chỗ ngồi bàn ghế rộng rãi thoải mái decor gỗ và màu tường ấm ",5
"6c57ff9df2a76264b13137a921d87f8b","không gian mát mẻ phù hợp với những bạn cần không gian học tập riêng tư đồ uống ngon bánh cũng ngon nữa",5
"6c57ff9df2a76264b13137a921d87f8b","quán cf khá tốt nhé mình quay lại đây lần t3 rồi vì muốn tìm kiếm 1 nơi nghỉ ngơi sau giờ học để tiếp tục học buổi chiều ssowz phải đi đi về về nè nước ở đây khá ngon tầm 810 ha mỗi box có không gian khá riêng tư á tầm 910 nè",5
"6c57ff9df2a76264b13137a921d87f8b","không gian ổn nước bình thường sử dụng matcha đài giá nước 4555",4
"6c57ff9df2a76264b13137a921d87f8b","không gian quán thoải mái nước ngon nhân viên dth",5
"6c57ff9df2a76264b13137a921d87f8b","trãi nghiệm đúng nghĩa đánh một giấc
 không gian sạch sẽ thoáng mát tương đối yên tĩnh với giường nệm êm ái đầy đủ tiện nghi từ wifi quạt ổ cắm điện bàn trong từng sleepbox ",5
"6c57ff9df2a76264b13137a921d87f8b","không gian tương đối sạch decor dễ thương box mình đi có kiến gương bụi quạt bụi box có màn che nên rất riêng tư máy lạnh phà phà nên không sợ nóng có để bình trà với khăn giấy ở ngoài để khách tự lấy nhà vệ sinh sạch ",5
"6c57ff9df2a76264b13137a921d87f8b","không gian và thiết kế của quán khá giống với chidori nhưng giá cả phải chăng hơn ",5
"6c57ff9df2a76264b13137a921d87f8b","trải nghiệm nhiều lần từ lúc quán khai trương tới hiện tại vẫn rất hài lòng như lúc đầu đối với cá nhân mình thấy rất hợp với đồ ăn và nước uống của quán sinh tố bơ và các món trà trái cây rất hợp gu mình không gian trên box thoải mái ",5
"6c57ff9df2a76264b13137a921d87f8b","nước uống và bánh rất ngon đáng để thử ạ",5
"6c57ff9df2a76264b13137a921d87f8b","nước tạm ok
dịch vụ chưa rõ
12h trưa 3110 tầng 2 có nhiều box ồn nhưng k thấy nhân viên xử lý",1
"6c57ff9df2a76264b13137a921d87f8b","nước ngon nè dịch vụ oke nha nvien cute tận tâm concept quán đẹp lắm vào checkin hay nghỉ ngơi đều akelo quán hay mở nhạc nhẹ nhàng chill phết bị cái lúc cao điểm thì hơi khó để xe nma có chú bảo vệ dắt giùm nữa",5
"6c57ff9df2a76264b13137a921d87f8b","các bạn nhân viên nhiệt tình hướng dẫn
quán decor khá là xinh xắn
không gian yên tĩnh mát mẻ
sẽ quay lại vào lần sau",5
"6c57ff9df2a76264b13137a921d87f8b","sạch sẽ nhân viên thân thiện
không gian thoải mái",5
"6c57ff9df2a76264b13137a921d87f8b","nói tht thì ở đây điều oce nhân viên dthw thứ khiến cho mình khó chịu đánh 1 sao vì
ở đây có chú bảo vệ làm việc kh giúp đỡ khách hàng dắt xe khi hỏi con cũng làm ",1
"6c57ff9df2a76264b13137a921d87f8b","lần đầu đi thử và thấy rất bất ngờ luôn hồi trước chỉ đi chidori lần này đi ở đây mà thấy giá rẻ hơn nhiều dịch vụ vẫn tốt và chuyên nghiệp mn nên đi thử nha",5
"6c57ff9df2a76264b13137a921d87f8b","lần đầu tiên sử dụng dịch vụ của quán khá hài lòng
nhân viên phục vụ chu đáo box sạch sẽ nước cũng ổn",5
"6c57ff9df2a76264b13137a921d87f8b","lần đầu tới đánh một giấc tui đã bị lừa trưa nay mình có oder 1ly matcha latte nma mình để về mới lấy lúc oder mình hỏi rõ nhân viên là quán dùng matcha gì bạn í bảo matcha nhật rõ to xong mình hỏi thêm loại nào thế ạ bạn bảo k ",1
"6c57ff9df2a76264b13137a921d87f8b","luôn ủng hộ quán từ những ngày khai trương đến hôm nay xin tạm biệt
mình ủng hộ quán từ hồi like page  2 tiếng đi chắc cỡ chục lần có lần box đông mình vẫn đợi 20p để sử dụng dịch vụ nhưng sau 2 tháng gần đây thì gặp cảm ",1
"6c57ff9df2a76264b13137a921d87f8b","nhân viên thái độ nv tính lộn bill cho khách nhưng lên xin thêm tiền bù rất thái độ trả box nv trả lời bằng giọng thái độ zô quán nv nói chuyện um sùm",1
"6c57ff9df2a76264b13137a921d87f8b","nhân viên thái độ kinh khủng

mình thấy có quá nhiều đánh giá thái độ nhân viên nhưng vẫn chọn trải nghiệm vì ",1
"6c57ff9df2a76264b13137a921d87f8b","nhân viên nhiệt tình không gian dễ chịu và mát mẻ ạ sẽ ủng hộ nhiều lần sau",5
"6c57ff9df2a76264b13137a921d87f8b","nhân viên phục vụ rất thiếu thiện chí lúc mình order thì mặt lúc nào cũng khó chịu nói chuyện cộc lốc không hề hướng dẫn cụ thể nên mình hiểu lầm khi gọi món thay vì giải thích nhẹ nhàng bạn nhân viên lại tỏ thái độ khó chịu với khách ",1
"6c57ff9df2a76264b13137a921d87f8b","mình đi hôm có ưu đãi like fanpage đc tặng thêm 2h dùng bed nằm tận 6 tiếng quá đã lunnước ngon mấy chị nhân viên dth giá thì quá là mềm so với các dịch vụ cf bed mình từng đi  ",5
"6c57ff9df2a76264b13137a921d87f8b","bánh ngon chocomint ngon không gian quán sạch sẽ mát",5
"6c57ff9df2a76264b13137a921d87f8b","nhân viên nhiệt tình thái độ phục vụ tốt ko gian thoáng mát sạch sẽ trv nước mình thử món nào cũng ngon sẽ đến quán nhiều lần",5
"6c57ff9df2a76264b13137a921d87f8b","nhân viên nhiệt tình nước ngon sạch sẽ đáng để ghé thử",5
"6c57ff9df2a76264b13137a921d87f8b","mình thấy không gian sạch sẽ mát với thơm lắm ạ dô là chỉ mún nằm ngủ thoi
1 nơi tránh nóng cho hssv
mình đi buổi trưa nên yên tĩnh lắm nè nước uống ngon trang trí đẹp ạ ",5
"6c57ff9df2a76264b13137a921d87f8b","nhân viên dễ thương tận tâm quán xinh không gian ấm áp rcm mn nên ghé ủng hộ quán nhé ạ",5
"6c57ff9df2a76264b13137a921d87f8b","nhân viên dễ huôngnhiệt tình",5
"6c57ff9df2a76264b13137a921d87f8b","đi nhiều lần r nhma lần nào cũng oki nha v nhân viên cũng dth quá tr làm lộn món cho mình xong cũng chủ động đổi món lại nữa",5
"6c57ff9df2a76264b13137a921d87f8b","sleepbox rộng rãi sạch sẽ mềm mùi thơm lắm ạ
nước uống ngon nha
hơi ồn ào mạnh ai là người đó nói mình thấy hơi ồn và khi các bạn dọn đâu đó ",5
"6ea154afb9406af7fe9d8b417143afa4","một di tích lịch sử trong chiến tranh việt nam nơi tố cáo tội ác của mĩ nguỵ nơi đây rất đáng tham quan và tìm hiểu qua đó biết ơn thế hệ cha ông đã gầy dựng nền độc lập ",5
"6ea154afb9406af7fe9d8b417143afa4","hoà bình ngày hôm nay được đổi bằng xương máu của không biết bao nhiêu thế hệ cha ông đi trước
bước vào đây luôn đem đến cho mình một cảm giác khó tả rùng rợn với tội ác của ",5
"6ea154afb9406af7fe9d8b417143afa4","nhà tù phú lợi bình dương có diện tích khoảng 77082m2 và được nhà nước xếp hạng di tích lịch sử quốc gia vào ngày 10071980
nhà tù nay được xem là một trong những nhà tù lớn nhất thời mỹ  diệm ở khu vực ",5
"6ea154afb9406af7fe9d8b417143afa4","hoang sơ nhưng thú vị  khuya đến sẽ rất hợp  thích để cắm trại và tìm cảm giác mạnh  
thoáng mát và rất rộng nhưng nhiều muỗi",5
"6ea154afb9406af7fe9d8b417143afa4","nhà tù nằm gần trung tâm thành phố thủ dầu một bình dương 3km đường đi đến dễ dàng không hạn chế xe khách các loại đường vào cấm xe tải nhưng vẫn cho xe khách 45 chỗ vào được tới nơi di tích nhà tù phú lợi nằm trong khuôn viên cây ",4
"6ea154afb9406af7fe9d8b417143afa4","trong một ngày  mồng một tháng mười hai
nào ai ngờ không có nửa ngày mai
chúng tôi chết trong đêm dài tàn khốc ",5
"6ea154afb9406af7fe9d8b417143afa4","nằm ở thành phố thủ dầu một bình dương cách cao tốc mỹ phước tân vạn 700m tức 3  đến 4 phút đi xe máy cách trường đại học thủ dầu một 300m bên trong có rạp chiếu phim chứa được 150 người có khu trưng bày rộng chứa các mô hình và các di ",5
"6ea154afb9406af7fe9d8b417143afa4","là một trong 6 nhà tù khét tiếng nhất thời chiến lúc bấy giờ",5
"6ea154afb9406af7fe9d8b417143afa4","làm sao để liên hệ với ban quản lý khu di tích đưực ạ em gọi sdt cho trên mạng mà không ai nghe ạ",5
"6ea154afb9406af7fe9d8b417143afa4","mặc dù vẫn có người dọn nhưng mà trong nhà giam vẫn có dơi bay và chất thải của chúng đi vào chú ý có những tổ ong trong lô cốt và đài quan sát nhé",4
"6ea154afb9406af7fe9d8b417143afa4","bác bảo vệ vui tính  nay đi một mình mà còn trời mưa nữa  cả khu không có ai khá lãng mạn cho đến khi một mình vào nhà tu  đậu xanh sợ vlin",5
"6ea154afb9406af7fe9d8b417143afa4","quang cảnh nơi đây thoáng đãng và yên tĩnh nét đẹp hoang dã của lịch sử rất đáng để tham quan",5
"6ea154afb9406af7fe9d8b417143afa4","hơi rùng rợn nhưng là lịch sử hào hùng",5
"6ea154afb9406af7fe9d8b417143afa4","rộng thoáng mát nơi cắm trại dành cho mọi tầng lớp ttn ",5
"6ea154afb9406af7fe9d8b417143afa4","mình học và đã bt nhiều thứ ở đây nhưng gần và bận việc nên chx ik đc",5
"6ea154afb9406af7fe9d8b417143afa4","địa điểm rất thú vị cho những ai yêu thích khám phá lịch sử tìm hiểu thêm sự khổ cực của những người tù ở cái nơi gọi là địa ngục trần gian hiện tại nơi đây còn lưu giữ khá nhiều hiện vật mà khi xửa thực dân đã dùng để đàn áp ý chí của ",5
"6ea154afb9406af7fe9d8b417143afa4","bối cảnh quay phim xưa rất ok",5
"6ea154afb9406af7fe9d8b417143afa4","những người đó bị giam giữ tại nhà tù phú lợi",4
"6ea154afb9406af7fe9d8b417143afa4","không gian yên tĩnh không tốn tiền vé cô chú bảo vệ cũng rất vui vẻ thân thiện",5
"6ea154afb9406af7fe9d8b417143afa4","tui tới hôm cuối tuần đáng lẽ nhà tù đã đóng cửa không để khách vô tham quan do đó chỉ có tụi tui tự do khám phá mọi ngóc ngách mà không bị cản trở bởi các khách đoàn khác mọi người có thể xin bác bảo vệ cho vô lúc cuối tuần bằng cái mỏ ",4
