"place_id","text","rating"
"bd5e1e167d3beb3757ee098bafea7b28","đồ ăn rất ngon nhân viên phục vụ thì cũng nhiệt tình nhưng mà mình nghỉ quán nên training kĩ lại những nhân viên mới hỏi gì cũng kêu em không biết rồi đơ mắt nhìn mình và kh nhờ những bạn khác trả lời mình những câu hỏi đó",4
"bd5e1e167d3beb3757ee098bafea7b28","ăn ngon hợp khẩu vị
được free tráng miệng và nước ngọt",5
"bd5e1e167d3beb3757ee098bafea7b28","đồ ăn ăn được giá cả hợp lý",5
"bd5e1e167d3beb3757ee098bafea7b28","đi ngày 142 lúc 19h30 ngay ngày lễ tuy đông nhưng không chờ lâu lắm tầm 15p là có bạn check bàn rồi nhân viên nhiệt tình hỏi khách khi fill nước hoặc dọn bàn khi dư nhiều dĩa đồ ăn hợp khẩu vị với tui  dân miền trung  nhân viên thân thiện gà hay thịt đều đưa ý kiến cắt hộ cho mình ưng nha",5
"bd5e1e167d3beb3757ee098bafea7b28","món ăn ngon giá hợp lý nhân viên nhiệt tình",5
"bd5e1e167d3beb3757ee098bafea7b28","đồ ăn rất ngon giá cả hợp lí nhân viên nhiệt tình dễ thương",5
"bd5e1e167d3beb3757ee098bafea7b28","quán ăn ngon rẻ nv nhiệt tình sẽ ủng hộ tiếp",5
"bd5e1e167d3beb3757ee098bafea7b28","đồ ăn ngon lên món nhanh nhân viên nhiệt tình phục vụ  ",5
"bd5e1e167d3beb3757ee098bafea7b28","ngày 18012026 chìu cỡ 17h17h30 ấy ạ em ghé bên mình ăn ngồi sát ngoài gần vỉa hè cho dễ ngắm đường lúc sau có chó không biết của ai đi ngang nó chỉ đi ngang hửi hửi chưa làm gì ai chú có thể xua tay nhẹ ha lấy cây xua xua nó đi ha ",3
"bd5e1e167d3beb3757ee098bafea7b28","đồ ăn ngon nhân viên nhiệt tình thân thiện",5
"bd5e1e167d3beb3757ee098bafea7b28","mới khai trương nên ăn rất đông giá mình thấy khá phải chăng tuy nhiên chưa thực sự ngon như đánh giá    đánh giá độ ngon 6510 thôi bù lại đang free nước và tặng món",3
"bd5e1e167d3beb3757ee098bafea7b28","đồ ăn bình thường không wow như tưởng tượng nma được cái lên món nhanh bàn dơ kêu nhân viên lau xong mà vẫn thấy dơ chén cũng dơ kim chi mình ăn thấy giống như bị hư nên ăn có một miếng rồi bỏ đọc đánh giá từ gg map đến tiktok thấy ai cũng khen nên cảm thấy hơi thất vọng",2
"bd5e1e167d3beb3757ee098bafea7b28","quán rộng hơn các chi nhánh bên thanh phố
khá đông khách nhưng lên món nhanh
đang được free nước và rau câu tráng miện",5
"bd5e1e167d3beb3757ee098bafea7b28","đồ ăn ngon vừa miệng giá rẻ nhân viên thân thiện dễ thương",5
"bd5e1e167d3beb3757ee098bafea7b28","đồ ăn bao ngon rất đa dạng  mình đi 2 ng ăn no nê hết 500k  giảm 20 còn có 400k à công nhận rẻ thiệt nha",5
"bd5e1e167d3beb3757ee098bafea7b28","đồ ăn ngon vị rất ok 4 người đi ăn hết 666k nó căng bụng có nước miễn phí còn tráng miệng khi gọi thanh toán nhân viên nhiệt tình đồ ăn lên nhanh lo ăn quá ko có ảnh rồi",5
"bd5e1e167d3beb3757ee098bafea7b28","nhân viên nhiệt tình đồ ăn ngon mn nên trải nghiệm",5
"bd5e1e167d3beb3757ee098bafea7b28","đồ ăn ngon rẻ nhân viên nhiệt tình nên đến ăn nhé mn",5
"bd5e1e167d3beb3757ee098bafea7b28","đồ ăn ngon phục vụ nhanh chóng nhiệt tình
mình đã đi nhiều lần ở đây  ",5
"bd5e1e167d3beb3757ee098bafea7b28","không gian thoáng mát chị mỹ ngọc thân thiện takecare rất tốt cảm ơn quán đã cho e 1 bữa ăn tuyệt vời  ",5
"bd5e1e167d3beb3757ee098bafea7b28","đồ ăn ngon rẻ không gian thoáng mát nhân viên phục vụ nhiệt tình thân thiện",5
"bd5e1e167d3beb3757ee098bafea7b28","đồ ăn ngon nhân viên nhiệt tình thân thiện sẽ quay lại",5
"bd5e1e167d3beb3757ee098bafea7b28","đồ ăn ngon nhân viên dễ thương quán rộng",5
"bd5e1e167d3beb3757ee098bafea7b28","vô tình đi ngang thấy đông nên ghé vào ăn thử quán khá đông thấy ngồi full bàn khi vào đa phần những quán khác sẽ có nhân viên đến hỏi mình đi mấy người và sẽ sắp xếp bàn cho mình ngồi còn ở đây tự kiếm chỗ tự gọi nhân viên đến dọn dẹp ",3
"bd5e1e167d3beb3757ee098bafea7b28","đồ ăn ngon quán nhiệt tình nhiều chương trình ưu đãi cho khách hàng",5
"bd5e1e167d3beb3757ee098bafea7b28","đồ ăn ngon nhân viên dễ thương nhiệt tình ",5
"bd5e1e167d3beb3757ee098bafea7b28","đồ ăn ngon nhân viên rất là nhiệt tình",5
"bd5e1e167d3beb3757ee098bafea7b28","đồ ăn ngon nhân viên siêu dễ thương và chu đáo",5
"bd5e1e167d3beb3757ee098bafea7b28","đồ ăn ngon  giá cả hợp lí  nhân viên nhiệt tình  sẽ quay lại lần tới",5
"bd5e1e167d3beb3757ee098bafea7b28","đến lò đất bbq dui lắm mọi người 
thứ 1 đồ ăn lên bàn rất là nhanh luôn nha  lên 1 cái ăn k kịp mấy má ơi 
thứ 2 mấy bạn nhân viên hài hước dữ lắm  dui dẻ  chiều khách hàng vô cùng lun ",5
"bd5e1e167d3beb3757ee098bafea7b28","đồ ăn ngon món lên nhanh lắm luon mặc dù đông khách  có tráng miệng nữa hơi ngọt xíu nhưng mà vẫn okla nhân viên dễ thương nhiệt tình thay vỉ nướng và châm đá cho tụi mình liên tục sẽ ghé nữaaaa  ",5
"bd5e1e167d3beb3757ee098bafea7b28","đồ ăn ngon  nhân viên rất nhiệt tình và thân thiện",5
"bd5e1e167d3beb3757ee098bafea7b28","gần đây có ghé quán ăn theo lời giới thiệu của bạn bè món ăn vừa vị lên nhanh đồ nướng cũng được ướp thấm vị ăn khá oki nhân viên phục vụ nhiệt tình và take care khách ổn thấy giá cả cũng hợp lý và khá tốt so với trải nghiệm nhận được",5
"bd5e1e167d3beb3757ee098bafea7b28","đồ ăn ngon nhân viên dễ thương nhiệt tình",5
"bd5e1e167d3beb3757ee098bafea7b28","đồ ăn ngon món lên nhanh nhân viên nhiệt tình",5
"bd5e1e167d3beb3757ee098bafea7b28","lúc tới ăn thì quán khá đông nhưng hông phải đợi chờ lâu tại nhân viên nhiệt tình lắm đồ ăn cũng oke nữa nói chung là rất hài lòng cho bữa tối trải nghiệm ở đây đi với gia đình bạn bè càng vui nữa chắc chắn sẽ quay lại ủng hộ quán",5
"bd5e1e167d3beb3757ee098bafea7b28","quán quen  giá rẻ chất lượng ok nhiều món free nước  tráng miệng thường xuyên tặng thêm đồ ăn 99 điểm",5
"bd5e1e167d3beb3757ee098bafea7b28","đồ ăn khá ok nước chấm ngon giá hợp lí tuy nhiên quán đông nên lên món hơi lâu 2ng ăn xong ngồi nhìn ngta ăn đợi 1520p mới lên món mới riêng món bò cuộn nấm kim châm mình thấy dở nhất trong các quán từng ăn mùi hơi hôi nấm nhìn như nấm cũ k được trắng như các quán khác còn lại mọi thứ ok phù hợp giá tiền",5
"bd5e1e167d3beb3757ee098bafea7b28","đồ ăn ngon giá cả phải chăng nhân viên phục vụ nhiệt tình",5
"bd5e1e167d3beb3757ee098bafea7b28","đồ ăn ngon giá cả phù hợp nhân viên dễ thương sẽ ghé ủng hộ",5
"bd5e1e167d3beb3757ee098bafea7b28","không gian quán thoáng mát sạch sẽ thức ăn vừa miệng giá cả bình dân hợp lý thích hợp với mọi người mọi giới nhân viên phục vụ nhiệt tình chu đáo tuy nhiên nên chú trọng tới khu nhà vệ sinh nên đầu tư sạch sẽ hơn và dọn dẹp thường xuyên không nên để nước chảy tràn lan",3
"bd5e1e167d3beb3757ee098bafea7b28","đồ ăn ngon pv tốt",5
"bd5e1e167d3beb3757ee098bafea7b28"," trước đó là có đánh giá rồi nhưng mình phải sửa lại 
nhân viên lại giới thiệu kêu là đi 3ng thì sẽ tặng 1 dĩa hào nướng  xong kêu đánh giá trên gg  mình đợi từ lúc chưa lên hết món đến lúc nhắc nhân viên hẳn 3 ",1
"bd5e1e167d3beb3757ee098bafea7b28","khách vô nhân viên đứng nhìn ko hỏi đi mấy ngừoi ko sắp bàn ko dẫn khach vao để đứng lóng ngóng tự tìm bàn ngồi mặc dù quán ko đông lắm có mấy bạn nv mới cần training kĩ hơn hỏi cái gì cũng ko biết ko và khi đem giấy menu ra để tránh ",3
"bd5e1e167d3beb3757ee098bafea7b28","ổn giá sinh viên học sinh phục vụ tốt",4
"bd5e1e167d3beb3757ee098bafea7b28","quán lò đất bbq đúng kiểu dành cho học sinh  sinh viên giá cả rất mềm mà đồ ăn vẫn chất lượng thịt nướng được ướp thấm vị nướng lên thơm phức không bị khô mình gọi vài phần thịt bò ba rọi và xiên rau củ tất cả đều tươi và ngon nước ",5
"bd5e1e167d3beb3757ee098bafea7b28","đồ ăn ngon giá cũng phải chăng có việc đợi lên món khá lâu",4
"bd5e1e167d3beb3757ee098bafea7b28","đồ ăn ngon giá hạt dẻ nhiều chương trình ưu đãi cho khách hàng",5
"bd5e1e167d3beb3757ee098bafea7b28","đồ ăn ngon giá khá ổn mấy bạn nhân viên dễ thương phục vụ nhanh ",5
"bd5e1e167d3beb3757ee098bafea7b28","giá cả vừa phải nhân viên dễ thương phục vụ nhiệt tình đồ ăn vừa vị",5
"bd5e1e167d3beb3757ee098bafea7b28","đồ ăn ngon giá rẻ nhân viên nhiệt tình dễ thương",5
"bd5e1e167d3beb3757ee098bafea7b28","đồ ăn ngon giá vừa túi tiền nếu so sánh bbq khác thì đây rẻ hơn nước uống các loại miễn phí
phục vụ tốt đầu bếp làm nhanh khách không phải đợi lâu",5
"bd5e1e167d3beb3757ee098bafea7b28","giá hợp lý món ngon phục vụ lịch sự ok lắm nha ",5
"bd5e1e167d3beb3757ee098bafea7b28","đồ ăn ngon hình thức chỉnh chu nhân viên nhiệt tình mình tip thêm cho nhân viên nhiệt tình nhưng lại thấy nv đưa tip cho quản lí cảm thấy hơi lạ  ",1
"bd5e1e167d3beb3757ee098bafea7b28","nhân viên rất thân thiện có mấy bé nhỏ mới chưa có kinh nghiệm nên hơi chậm nhưng chấp nhận được món ăn ngon giá hợp lý ăn mấy lần rồi nay mới rành cơ hội review",5
"c98f0813f7c2bb163f231316772d6d82","quán có hai lầu chỗ ngồi nhiều nhưng luôn đông nhất là cuối tuần đi tầm sau 5h có khả năng phải xếp hàng ",5
"c98f0813f7c2bb163f231316772d6d82","đồ ăn ngon  nhân viên phục vụ tận tình",5
"c98f0813f7c2bb163f231316772d6d82","đồ ăn ngon nhân viên phục vụ oke",5
"c98f0813f7c2bb163f231316772d6d82","đồ ăn ngon mấy bạn nhân viên rất nhiệt tình luôn",5
"c98f0813f7c2bb163f231316772d6d82","đồ ăn ngon nhân viên phục vụ nhiệt tình",5
"c98f0813f7c2bb163f231316772d6d82","đồ ăn ngon
nhân viên phục vụ nhiệt tình",5
"c98f0813f7c2bb163f231316772d6d82","đồ ăn ngon  nhân viên cũng z",5
"c98f0813f7c2bb163f231316772d6d82","đồ ăn ngon nhân viên nhiệt tình lắm nha giá cả oke có hát sn cho khách nữa",5
"c98f0813f7c2bb163f231316772d6d82","đồ ăn ngon nhân viên nhiệt tình dthh",5
"c98f0813f7c2bb163f231316772d6d82","đồ ăn ngon nhân viên nhiệt tình đẹp",5
"c98f0813f7c2bb163f231316772d6d82","đồ ăn ngon
nhân viên nhiệt tình",5
"c98f0813f7c2bb163f231316772d6d82","nhân viên nhiệt tình đồ ăn tươi ngonnn vuýp nênn thử nha mn  ",5
"c98f0813f7c2bb163f231316772d6d82","nhân viên nhiệt tình nhanh nhẹn  đẹp trai fill đồ ăn nhanh ngồi đc lâu",5
"c98f0813f7c2bb163f231316772d6d82","ngon bổ rẻ nhân viên nhiệt tình dễ thương sẽ ủng hộ dài dài",5
"c98f0813f7c2bb163f231316772d6d82","nhân viên quán phục vụ nhiệt tình dễ thương quán ăn sạch sẽ đồ ăn thì rất ngon sẽ ghé ủng hộ quán lần tiếp theo  ",5
"c98f0813f7c2bb163f231316772d6d82","tự tin là quán ngon nhất khu hoàng diệu 2 nha đồ ngon nhân viên thân thiện với nhiệt tình cực ăn tận 3 bàn mới chịu đóooo",5
"c98f0813f7c2bb163f231316772d6d82","trải nghiệm tốt nhân viên nhiệt tình và đồ ăn ngon nha nên đến thử",5
"c98f0813f7c2bb163f231316772d6d82","nhiều đồ ăn ngon mình vào lúc 9h vẫn còn bàn nhưng bàn ở phía trong nóng nực vãi  không gian k dc rộng lắm bàn này khói qua bàn kia cay mắt huhu  đồ ăn ngon cũng tươi mà mình vào trễ r kh thấy full đồ mới nữa ",5
"c98f0813f7c2bb163f231316772d6d82","bỏ ra gần 400k nhưng đổi lại là một trải nghiệm cực kỳ tệ

tối 19012026 quán nhận khách sát giờ đóng cửa trong khi thực tế hoàn toàn ",1
"c98f0813f7c2bb163f231316772d6d82","lần đầu tiên đi ăn đồ ăn ngon fill nhanh nhân viên dễ thương sẽ quay lại lần 2",5
"c98f0813f7c2bb163f231316772d6d82","nhân viên dễ thưn mấy anh nv tinh tế lắm ạ  đồ ăn thì cũng cũng nha ",5
"c98f0813f7c2bb163f231316772d6d82","có chỗ đỗ xe nhân viên take care khách tốt có đội ngũ nv tốt hơn nhiều so với những quán buffet khác trên đường này đồ ăn ok mà tôm hơi bở á đi sớm nên là thấy nhân viên fill đồ nhanh khay muỗng hơi bẩn á cái khay để đựng dĩa lấy đồ ",5
"c98f0813f7c2bb163f231316772d6d82","đã ăn nhìu lần và siu ngong với tầm giá này mìn tháy qá oki rùi nhà mìn thít ăn gỏi sứa va du heo nhấtt
có 1 nhượt điểm duy nhất là bàn hơi nhỏ và chật nên hơi khó để đồ ăn và di chuyển thui còn lại 5 sao ậ",5
"c98f0813f7c2bb163f231316772d6d82","quán 23h đóng cửa 22h mình vào khách giờ này khá đông nhưng quầy line đồ thì không chịu more lên 513k cho 3 người  thật không xứng đáng mọi ngừoi nên né ra  ",1
"c98f0813f7c2bb163f231316772d6d82","đánh giá buffet nướng
quán buffet theo kiểu bình dân không gian hơi chật và bàn ghế sát nhau nhưng bù lại khá nhộn nhịp và phù hợp khi đi nhóm bạn nhìn chung ngồi lâu hơi nóng vì ",5
"c98f0813f7c2bb163f231316772d6d82","quán ăn ngon mát mẻ và đặc biệt nhân viên rất thân thiện dễ thươnggggggg",5
"c98f0813f7c2bb163f231316772d6d82","quán ăn ngon  nhiều món fill lên liên tục  mấy bạn nhân viên nhiệt tình dễ thương",5
"c98f0813f7c2bb163f231316772d6d82","không gian quán thoáng mát nhân viên thân thiện dễ thương  anh tuấn anh đồ ăn ok quầy line đa dạng phong phú mọi người nên tới ăn thử bên chi nhánh này nha",5
"c98f0813f7c2bb163f231316772d6d82","mình thấy mọi trải nghiệm điều ok so với số tiền mình bỏ ra ở đây cũng không giới hạn thời gian nữa nên là k có cảm giác ăn phải vội vàng lắm quầy đồ ăn thấy lên món liên tục nè mình thấy là công việc cũng khác cực nên toàn là nam thôi quán cũng khá đông nên mn đi nhân viên có chậm xíu mn cũng thông cảm cho mấy bạn ấy với nha  ",5
"c98f0813f7c2bb163f231316772d6d82","đi vào dịp 2010 đông nhưng được take care nhiệt tình đồ ăn ngon hợp miệng",5
"c98f0813f7c2bb163f231316772d6d82","yêu yêu nhân viên nhiệt tình ăn ngon",5
"c98f0813f7c2bb163f231316772d6d82","đồ ăn bao ngon phục vụ khá tận tình đi đông thì ăn sẽ nhiều món hơn  tuy xếp hàng chờ chỉ 5 đến 10p hoặc hơn nhưng bù lại đồ ăn ngon nhân viên nhiệt tình trong khâu thay đĩa nướng từng bàn",5
"c98f0813f7c2bb163f231316772d6d82","đồ ăn cũng ngon nhất là vú heo ướp rất ngon nhưng bị trừ điểm là chén dĩa đũa ly rất dơ  mình cầm đũa lên thấy dính đầy cái màu trắng mình lau thì sạch  còn ly ban đầu vô mua vé bạn thu ngân đưa mình một ly có con gì dưới đáy ly á  xong ",3
"c98f0813f7c2bb163f231316772d6d82","hôm mình ăn thì tôm không tươi nướng xong là không còn miếng thịt tôm nào ăn luôn 
bù lại mấy món kia ăn vẫn được đồ ăn cũng nhiều có chân gà sườn thái đồ ăn ",4
"c98f0813f7c2bb163f231316772d6d82","180k tính luôn vat giá ổn đồ ăn xứng với tầm giá ăn trải nghiệm cũng ok",5
"c98f0813f7c2bb163f231316772d6d82","đồ ăn đa dạng tôm càng bạch tuộc đại dương các loại ốc và thịt tuy nhiên không được tươi với giá 139kvé chưa vat thì cũng tạm ổn buffet nước là 25kngười có nước ngọt và trà sữa ngoài ra quán còn có quầy đồ chiên nghêu hấp cá ",3
"c98f0813f7c2bb163f231316772d6d82","đồ ăn fill liên tục nè ăn ôk hơi ngấy xí cảm giác cũng tươi không khí vui vẻ thêm thuế và nước thì tầm gần 170",5
"c98f0813f7c2bb163f231316772d6d82","nhân viên dễ thương đồ ăn ngon ạ  ",5
"c98f0813f7c2bb163f231316772d6d82","quán đông ngồi sát nhau khó di chuyển ngợp khói thức ăn tẩm ướp vừa miệng chủ yếu heo bò tôm ít nướng xong teo héo nhân viên phục vụ nhiệt tình dễ thương đáng trải nghiệm nhưng không dùng lại",4
"c98f0813f7c2bb163f231316772d6d82","nhân viên nhiệt tình dễ thương đồ ăn siêu ngon",5
"c98f0813f7c2bb163f231316772d6d82","đồ ăn k ổn đâu mn thịt thì đông lạnh cứng ngắc nướng lên bèo bọt tùm lum tôm mực k tươi quầy chồ chế biến sẵn cũng khá nhạt nhẽo vừa ăn cong ra khỏi quán 10p là táo tháo rượt ngay",1
"c98f0813f7c2bb163f231316772d6d82","đồ ăn món chiên nguội khô dầu
nhân viên chu đáo nhiệt tình  tinh tế
vé 139k ",5
"c98f0813f7c2bb163f231316772d6d82","đồ ăn món ướp thì vừa ăn nghêu hấp với 1 vài món quá mặn súp cua ngon dịch vụ quầy đồ ăn lên liên tục các bạn nhân viên mau mắn nhiệt tình thường xuyên thay vỉ nướng dọn dĩa thừa nướng dùm khách lúc khách đi lấy thêm đồ ăn không gian hơi chật ngợp khi nviên bê đồ đi ngang cũng hơi sợ trúng quán cũng ok thêm vat",4
"c98f0813f7c2bb163f231316772d6d82","đồ ăn ngon anh nhân viên hảo nhiệt tình phục vụ dễ thương",5
"c98f0813f7c2bb163f231316772d6d82","đồ ăn ngon đặc biệt dưa hấu và trà sữa rất ngon đồ nướng oke nhưng ko nên ăn chim cut nha lâu chín lắm xem nước chấm bên trên đó mình thấy oke nhất vỉ nướng thay liên tục tới cuối vẫn còn trắng",5
"c98f0813f7c2bb163f231316772d6d82","động lực để đi ăn là vì nhận viên ưu nhìn đẹp trai phục vụ nhanh đồ ăn thì ổn thôi",5
"c98f0813f7c2bb163f231316772d6d82","quầy line đa dạng đồ ăn món nướng món cuốn món thái món hàn có tất luôn giá vé 139k buffet nước là 25k có trà sữa và trân châu luôn ts rất ngon nhân viên take care và thay vĩ nướng cho mình liên tục đồ ăn cũng được refill nhanh ",5
"c98f0813f7c2bb163f231316772d6d82","quán món ăn ngon nhân viên take care khách tốt đặt biệt la bạn nhân viên trực khu hôm mình tới cực dễ thương",5
"c98f0813f7c2bb163f231316772d6d82","đồ ăn từ món chính đến tráng miệng phong phú đa dạng nhân viên nhiệt tình phục vụ tốt nha shop đặc biệt takecare tốt khách hành mặc dù quán đông và thời điểm là cuối tuần good service",5
"c98f0813f7c2bb163f231316772d6d82","đồ ăn ngon khang phục vụ nhiệt tình",5
"c98f0813f7c2bb163f231316772d6d82","đồ ăn ngon  không gian thoải mái lặn lội 4km để tới trải nghiệm  1 sự trải nghiệm rất tốt  hơn hẳn nhưng nơi đã đi ăn bằng giá",5
"c98f0813f7c2bb163f231316772d6d82","đồ ăn ở quán đa dạng nhiều món nhân viên phục vụ tốt chu đáo giá cả phù hợp",5
"c98f0813f7c2bb163f231316772d6d82","đồ ăn ok nhân viên tận tình ạ quán 10 điểm nhaaaa",5
"c98f0813f7c2bb163f231316772d6d82","đồ ăn ok
nhân viên nhiệt tình gắp tôm xong mấy anh cắt mấy cái càng dùn luôn",5
"c98f0813f7c2bb163f231316772d6d82","quán ngon hấp dẫn đồ ăn tự chọn đa dạng
phục vụ nhiệt tình quay lại quay lại ",5
"c98f0813f7c2bb163f231316772d6d82","đồ ăn ở đây ngon và tươi bạn nhân viên tên khang phục vụ tận tình chu đáo",5
"c98f0813f7c2bb163f231316772d6d82","đồ ăn ngon lên đồ nhanh nhân viên thân thiện lắm ạ",5
"c98f0813f7c2bb163f231316772d6d82","đồ ăn ngon phục vụ rất nhiệt tình",5
"c98f0813f7c2bb163f231316772d6d82","quán oke không gian mát mẻ k phải đợi lâu đồ ăn fill liên tục",5
"c98f0813f7c2bb163f231316772d6d82","đồ ăn ngon phục vụ nhiệt tình  ",5
"ccca7578a09b3b5807afe0ace283d379","quán cafe đẹp không gian ấm cúng",5
"ccca7578a09b3b5807afe0ace283d379","thức uống lên nhanh nhân viên vui vẻ đáng trải nghiệm",5
"ccca7578a09b3b5807afe0ace283d379","quán nước ngon nhân viên phục vụ nhiệt tình ",5
"ccca7578a09b3b5807afe0ace283d379","không gian đồ uống nhân viên sạch sẽ  10đ",5
"ccca7578a09b3b5807afe0ace283d379","sleepbox ok nhất mà mình từng trải nghiệm ở thủ dầu một giá rẻ có kèm nước uống phòng mát sạch sẽ",5
"ccca7578a09b3b5807afe0ace283d379","tốt sạch sẽ nhân viên dễ thương thân thiện",5
"ccca7578a09b3b5807afe0ace283d379","ảnh chủ tuyệt vời  quán nước uống ngon với vừa giá tiền ạ",5
"ccca7578a09b3b5807afe0ace283d379","sleep box khá rộng nằm thoải mái giá cả thì tầm trung quá là ok",5
"ccca7578a09b3b5807afe0ace283d379","quán xinh nước ngon nhân viên cute giá hợp lý",5
"ccca7578a09b3b5807afe0ace283d379","nước ổn không gian cũng được
ngồi học bài ở phía trên từng ổn hơn ở dưới",5
"ccca7578a09b3b5807afe0ace283d379","nước ngon view đẹp nhe mọi ngừ",5
"ccca7578a09b3b5807afe0ace283d379","nước ngon sạch sẽ nhân viên nhiệt tình",5
"ccca7578a09b3b5807afe0ace283d379","nước ngon quán thoáng mát sạch sẽ 10đ",5
"ccca7578a09b3b5807afe0ace283d379","sạch sẽ thoáng mát nhưng mà mùi chanh xã nồng quá mình bị say xe vào đây cảm giác như đang ngồi trên xe dịch vụ á chứ còn lại oke nước uống hợp khẩu vị yên tĩnh thích hợp để nghỉ ngơi và học tập",5
"ccca7578a09b3b5807afe0ace283d379","quán xinh nhạc hay nv dễ thương chu đáo",5
"ccca7578a09b3b5807afe0ace283d379","nước ngon quán sạch sẽ
nhân viên dễ huông ",5
"ccca7578a09b3b5807afe0ace283d379","quán rất sạch sẽ và thoáng nhân viên nhiệt tình giá cả hợp lí vs hssv nên ghé",5
"ccca7578a09b3b5807afe0ace283d379","nước ngon phục vụ dễ thương",5
"ccca7578a09b3b5807afe0ace283d379","nhân viên nhiệt tình dễ thương giá cả oke phù hợp với sinh viên  ",5
"ccca7578a09b3b5807afe0ace283d379","nước ngon gấu bông cute lông gấu xịn mềm chứ k giống mấy quán xài gấu dởm mình k thích hihi",5
"ccca7578a09b3b5807afe0ace283d379","quán dễ thương nhân viên nhiệt tình",5
"ccca7578a09b3b5807afe0ace283d379","nhân viên nhẹ nhàng dể thương
nước ngon nên thử nha",5
"ccca7578a09b3b5807afe0ace283d379","nhân viên dễ thương có phòng nghỉ rộng rãi",5
"ccca7578a09b3b5807afe0ace283d379","quán nv dth nhiệt tình vui vẻ nói chung 10",5
"ccca7578a09b3b5807afe0ace283d379","nhân viên nhiệt tình dễ thương đồ uống ngon phòng bed rộng rãi thoáng mát",5
"ccca7578a09b3b5807afe0ace283d379","quán vắng nên ngồi chill lắm chắc ch nhiều nguoief biết tới nước ngon nha",5
"ccca7578a09b3b5807afe0ace283d379","như trên review tiktok không gian sạch sẽ có máy lạnh mát yên tĩnh bed thơm mọi ng nên trải nghiệm",5
"ccca7578a09b3b5807afe0ace283d379","lần đầu ghé quán này mạng mạnh tới mức mình không nghĩ cviec mình có thể nhanh tới vậy có truyện tranh mượn đọc giải trí ở quầy order yên tĩnh thoải mái niceeee",5
"ccca7578a09b3b5807afe0ace283d379","nhân viên nhiệt tình quán so ciuuuuuu quá đi",5
"ccca7578a09b3b5807afe0ace283d379","box rộng rãi thoải mái không bị gò bó  sạch và có tận 20 box sạch sẽ
nhân viên nhiệt tình vui vẻ
mền trong box khá bé",5
"ccca7578a09b3b5807afe0ace283d379","nhân viên nhiệt tình nước ngon  giá rẻ",5
"ccca7578a09b3b5807afe0ace283d379","bed sạch sẽmát mẻ lắm nha mn nhân viên dễ thương chấm cho 5 tui là người chuyên đi mấy quán dạng sleep box như thế này thì tôi thấy quán này giá khá là ổn áp so với những quán tui đi ở bình dương",5
"ccca7578a09b3b5807afe0ace283d379","nhân viên nhiệt tình dễ thương  tư vấn từ a z
quán chill thoải mái riêng tư  sạch sẽ
nước uống ngon",5
"ccca7578a09b3b5807afe0ace283d379","mát mẻ thứ uống ngon nhân viên nhiệt tình",5
"ccca7578a09b3b5807afe0ace283d379","quán mát giá nước rẻ nhìn sang mà giá nước bình dân có khi bằng mấy quán vỉa hè luôn",5
"ccca7578a09b3b5807afe0ace283d379","nhân viên dễ thương quán sạch sẽ sẽ ủng hộ vào lần sau",5
"ccca7578a09b3b5807afe0ace283d379","quán mới mở sạch đẹp nhân viên dễ thương chủ quán thân thiện với khách",5
"ccca7578a09b3b5807afe0ace283d379","quán siu dễ thương nha chị chủ nhiệt tình thân thiện đồ uống hấp dẫn nha mn mn ghé ủng hộ cho smell coffee in bed nha",5
